{
  "schema_version": "2.0",
  "project_id": "NINEL",
  "unit_id": "NINEL-E01",
  "source_context": {
    "preproduction_effects": [
      {
        "effect_id": "NINEL-FX001",
        "source_reference": "production/vfx-plan.json#/effects/0"
      }
    ],
    "edit_segments": [
      {
        "segment_id": "NINEL-E01-ED001",
        "source_reference": "post/edit-plan.json#/segments/0"
      },
      {
        "segment_id": "NINEL-E01-ED002",
        "source_reference": "post/edit-plan.json#/segments/1"
      }
    ],
    "media_versions": [],
    "evidence": [],
    "delivery_targets": []
  },
  "items": [
    {
      "item_id": "NINEL-E01-FX001",
      "preproduction_effect_ids": [
        "NINEL-FX001"
      ],
      "edit_segment_ids": [
        "NINEL-E01-ED001",
        "NINEL-E01-ED002"
      ],
      "purpose": "Plan a screen replacement with finger occlusions during the camera move.",
      "source_version_ids": [],
      "current_output_version_id": null,
      "workstreams": [
        {
          "type": "plate",
          "applicability": "awaiting-input",
          "action": "Confirm plate identity, frame range, and handles before turnover.",
          "assumption": "No plate metadata or media was supplied."
        },
        {
          "type": "tracking",
          "applicability": "planned",
          "action": "Validate perspective and track stability through the camera move.",
          "assumption": "Camera and lens data remain awaiting turnover."
        },
        {
          "type": "rotoscoping",
          "applicability": "planned",
          "action": "Plan finger holdouts and inspect edge transitions when media arrives.",
          "assumption": "Occlusion frames have not been inspected."
        },
        {
          "type": "compositing",
          "applicability": "planned",
          "action": "Integrate perspective, reflections, black level, and interactive light.",
          "assumption": "Plate and insert versions remain awaiting media."
        },
        {
          "type": "lens-integration",
          "applicability": "planned",
          "action": "Match distortion, motion blur, and defocus to supplied evidence.",
          "assumption": "Lens characteristics are unknown."
        },
        {
          "type": "grain-integration",
          "applicability": "planned",
          "action": "Match grain only after the plate and delivery path are identified.",
          "assumption": "Grain characteristics have not been measured."
        }
      ],
      "dependency_ids": [],
      "review_status": "planned",
      "review_evidence_ids": [],
      "delivery": {
        "status": "not-planned",
        "target_id": null,
        "evidence_ids": []
      },
      "handoff_assumptions": [
        "Plate range, handles, lens data, and color pipeline remain awaiting turnover."
      ]
    }
  ],
  "dependencies": [],
  "assumptions": [
    "No media was supplied for inspection."
  ],
  "uncertainties": [
    "Output version and final delivery specification remain unknown."
  ]
}
